{
  "catalogId": "catalog:42980594a86c56de1f9eece060e5cb797b4c30a24dca551f92682bc658c4b82f",
  "generatedAt": "2026-01-01T00:00:00.000Z",
  "plugins": [
    {
      "authors": [
        "Cursor"
      ],
      "availableReleases": [
        {
          "canonicalContentDigest": "sha256:ffe69c9130cc5928a7e53fe30e7d931a6b3d3d55c689ff1b5eadce5da41fe500",
          "capabilities": [
            {
              "metadata": {},
              "name": "rule",
              "paths": [
                "rules/learning.mdc"
              ],
              "securityImpact": "none",
              "type": "rule"
            },
            {
              "metadata": {},
              "name": "skill",
              "paths": [
                "skills/learn/SKILL.md"
              ],
              "securityImpact": "none",
              "type": "skill"
            }
          ],
          "contentResolution": "complete",
          "fileIndex": [
            "plugin.json",
            "rules/learning.mdc",
            "skills/learn/SKILL.md"
          ],
          "manifestDigest": "sha256:486127ceb300c8fc4a5a7e872f232c5de8a673e4c2458c4801598dffbd29d5c9",
          "permissionSensitiveChanges": [],
          "pluginSubdirectory": "teaching",
          "publicationTimestamp": "2026-01-01T00:00:00.000Z",
          "releaseId": "release:18ce8f072ca693885ce731feffbd78dd1307c81a8ad43920edf991e2032176db",
          "releaseMetadata": {
            "catalogContract": "adea-catalog/2",
            "marketplaceEntry": {
              "category": "Developer Tools",
              "description": "Practice and learning workflows.",
              "name": "teaching",
              "source": "teaching"
            },
            "pluginManifest": {
              "license": "MIT",
              "name": "teaching",
              "version": "0.3.0"
            },
            "sourceDialect": "cursor"
          },
          "requiredConnectors": [],
          "requiredCredentials": [],
          "resolvedCommitSha": "2222222222222222222222222222222222222222",
          "resolvedRepositoryUrl": "https://github.com/cursor/plugins",
          "upstreamVersion": "0.3.0"
        }
      ],
      "capabilitySummary": {
        "rule": 1,
        "skill": 1
      },
      "categories": [
        "developer-tools",
        "education-research"
      ],
      "currentReleaseId": "release:18ce8f072ca693885ce731feffbd78dd1307c81a8ad43920edf991e2032176db",
      "description": "Practice and learning workflows.",
      "displayName": "teaching",
      "harnessCompatibility": {
        "claude-code": {
          "reasons": [
            "Files can be copied or translated into the harness layout."
          ],
          "responsibleCapabilities": [
            "rule",
            "skill"
          ],
          "status": "portable"
        },
        "codex": {
          "reasons": [
            "Files can be copied or translated into the harness layout."
          ],
          "responsibleCapabilities": [
            "rule",
            "skill"
          ],
          "status": "portable"
        },
        "cursor": {
          "reasons": [
            "The cursor marketplace dialect matches the cursor harness."
          ],
          "responsibleCapabilities": [
            "rule",
            "skill"
          ],
          "status": "native"
        },
        "generic-skill-mcp": {
          "reasons": [
            "Files can be copied or translated into the harness layout."
          ],
          "responsibleCapabilities": [
            "rule",
            "skill"
          ],
          "status": "portable"
        },
        "hermes": {
          "reasons": [
            "Files can be copied or translated into the harness layout."
          ],
          "responsibleCapabilities": [
            "rule",
            "skill"
          ],
          "status": "portable"
        },
        "opencode": {
          "reasons": [
            "Files can be copied or translated into the harness layout."
          ],
          "responsibleCapabilities": [
            "rule",
            "skill"
          ],
          "status": "portable"
        },
        "pi": {
          "reasons": [
            "Files can be copied or translated into the harness layout."
          ],
          "responsibleCapabilities": [
            "rule",
            "skill"
          ],
          "status": "portable"
        }
      },
      "icons": [],
      "keywords": [
        "developer-tools",
        "education-research",
        "teaching"
      ],
      "license": {
        "name": "MIT",
        "source": "plugin-manifest"
      },
      "pluginId": "plugin:cursor-official:teaching",
      "productGroupingKey": "teaching",
      "provenance": {
        "manifestPath": ".cursor-plugin/marketplace.json",
        "pluginSubdirectory": "teaching",
        "repositoryUrl": "https://github.com/cursor/plugins",
        "resolvedCommitSha": "2222222222222222222222222222222222222222",
        "sourceId": "cursor-official",
        "sourceManifestDigest": "sha256:4a966db84af9ff187daeb14eb178e268a3cb8b0727d71b426c9a4c6eeb30b052",
        "upstreamEntryDigest": "sha256:3ddc9dbedd1abc4ece09d80e4f4140e82b1213cd863ceb2c927ad5fc3a32e1fa"
      },
      "securityClassification": {
        "contentResolution": "complete",
        "level": "low",
        "permissionSensitiveChanges": [],
        "reasons": [
          "No permission-sensitive executable capability was detected."
        ]
      },
      "sourceId": "cursor-official",
      "upstreamPluginName": "teaching"
    },
    {
      "authors": [
        "Anthropic"
      ],
      "availableReleases": [
        {
          "canonicalContentDigest": "sha256:10462f80a006c7d518fcccb34d09981bf7fda532c4d0974e525ec2555a6a1ff0",
          "capabilities": [
            {
              "metadata": {},
              "name": "command",
              "paths": [
                "commands/prospect.md"
              ],
              "securityImpact": "none",
              "type": "command"
            }
          ],
          "contentResolution": "complete",
          "fileIndex": [
            "commands/prospect.md",
            "plugin.json"
          ],
          "manifestDigest": "sha256:885d9f4dc5ff4ebdf456c71f0c5b8216d8ec327847a835f070ba0e4141cf46c8",
          "permissionSensitiveChanges": [],
          "pluginSubdirectory": "plugins/sales",
          "publicationTimestamp": "2026-01-01T00:00:00.000Z",
          "releaseId": "release:dc304fb0c5f79f0fccbba74dcb29b78049d6972eadd084d05935384755b5a1f4",
          "releaseMetadata": {
            "catalogContract": "adea-catalog/2",
            "marketplaceEntry": {
              "category": "sales",
              "description": "Prepare sales work.",
              "name": "sales",
              "source": {
                "path": "plugins/sales",
                "source": "local"
              }
            },
            "pluginManifest": {
              "license": "MIT",
              "name": "sales",
              "version": "1.1.0"
            },
            "sourceDialect": "claude"
          },
          "requiredConnectors": [],
          "requiredCredentials": [],
          "resolvedCommitSha": "3333333333333333333333333333333333333333",
          "resolvedRepositoryUrl": "https://github.com/anthropics/claude-plugins-official",
          "upstreamVersion": "1.1.0"
        }
      ],
      "capabilitySummary": {
        "command": 1
      },
      "categories": [
        "business-operations"
      ],
      "currentReleaseId": "release:dc304fb0c5f79f0fccbba74dcb29b78049d6972eadd084d05935384755b5a1f4",
      "description": "Prepare sales work.",
      "displayName": "sales",
      "harnessCompatibility": {
        "claude-code": {
          "reasons": [
            "The claude marketplace dialect matches the claude-code harness."
          ],
          "responsibleCapabilities": [
            "command"
          ],
          "status": "native"
        },
        "codex": {
          "reasons": [
            "Files can be copied or translated into the harness layout."
          ],
          "responsibleCapabilities": [
            "command"
          ],
          "status": "portable"
        },
        "cursor": {
          "reasons": [
            "Files can be copied or translated into the harness layout."
          ],
          "responsibleCapabilities": [
            "command"
          ],
          "status": "portable"
        },
        "generic-skill-mcp": {
          "reasons": [
            "Files can be copied or translated into the harness layout."
          ],
          "responsibleCapabilities": [
            "command"
          ],
          "status": "portable"
        },
        "hermes": {
          "reasons": [
            "Files can be copied or translated into the harness layout."
          ],
          "responsibleCapabilities": [
            "command"
          ],
          "status": "portable"
        },
        "opencode": {
          "reasons": [
            "Files can be copied or translated into the harness layout."
          ],
          "responsibleCapabilities": [
            "command"
          ],
          "status": "portable"
        },
        "pi": {
          "reasons": [
            "Files can be copied or translated into the harness layout."
          ],
          "responsibleCapabilities": [
            "command"
          ],
          "status": "portable"
        }
      },
      "icons": [],
      "keywords": [
        "business-operations",
        "sales"
      ],
      "license": {
        "name": "MIT",
        "source": "plugin-manifest"
      },
      "pluginId": "plugin:claude-official:sales",
      "productGroupingKey": "sales",
      "provenance": {
        "manifestPath": ".claude-plugin/marketplace.json",
        "pluginSubdirectory": "plugins/sales",
        "repositoryUrl": "https://github.com/anthropics/claude-plugins-official",